{
  "schema_version": "2",
  "run_id": "fx-3-run",
  "label": "FX-3",
  "generated_utc": "2026-10-27T12:00:00Z",
  "redacted": true,
  "mode": "auto-enum",
  "summary": {
    "total": 1,
    "hosts": [
      "<TARGET-1>"
    ],
    "coverage": []
  },
  "findings": [
    {
      "schema_version": "2",
      "finding_id": "FX3-REDACTED",
      "rule_id": "LAB-FX3-REDACTED",
      "host": "<TARGET-1>",
      "port": "445",
      "service": "smb",
      "severity": "high",
      "title": "Redacted partial finding",
      "line": "credential=<REDACTED>",
      "evidence_path": "smb/<TARGET-1>/synthetic.txt",
      "evidence_paths": [
        "smb/<TARGET-1>/synthetic.txt"
      ],
      "triage": "operator-review-required"
    }
  ],
  "partial": true,
  "errors": [
    {
      "type": "dispatcher_error",
      "path": "smb/<TARGET-1>/_dispatcher.log",
      "error": "synthetic dispatcher returned rc 4"
    }
  ],
  "posture_quarantine": [
    {
      "type": "posture_quarantine",
      "host": "<TARGET-1>",
      "path": "smb/<TARGET-1>/posture.txt",
      "line": "<REDACTED>",
      "error": "synthetic malformed posture record"
    }
  ]
}
