{
  "schema_version": "2",
  "run_id": "fx-4l-run-1",
  "label": "FX-4L prior",
  "generated_utc": "2026-10-27T12:00:00Z",
  "redacted": false,
  "mode": "bulk-enum",
  "summary": {
    "total": 1,
    "hosts": [
      "local-rerun.invalid"
    ],
    "coverage": []
  },
  "findings": [
    {
      "schema_version": "2",
      "finding_id": "FX4L-OLD",
      "rule_id": "LAB-FX4L-OLD",
      "host": "local-rerun.invalid",
      "port": "0",
      "service": "linlocal",
      "severity": "medium",
      "title": "Prior local-only finding",
      "line": "synthetic lab observation",
      "evidence_path": "linlocal/local-rerun.invalid/synthetic.txt",
      "evidence_paths": [
        "linlocal/local-rerun.invalid/synthetic.txt"
      ]
    }
  ]
}
