{
  "schema_version": "2",
  "run_id": "fx-2l-v1-run",
  "label": "FX-2L v1",
  "generated_utc": "2026-10-27T12:00:00Z",
  "redacted": false,
  "mode": "bulk-enum",
  "summary": {
    "total": 2,
    "hosts": [
      "local-linux.invalid",
      "local-windows.invalid"
    ],
    "coverage": []
  },
  "findings": [
    {
      "schema_version": "2",
      "finding_id": "FX2L-LINUX",
      "rule_id": "LAB-FX2L-LINUX",
      "host": "local-linux.invalid",
      "port": "0",
      "service": "linlocal",
      "severity": "medium",
      "title": "Local Linux posture finding",
      "line": "synthetic lab observation",
      "evidence_path": "linlocal/local-linux.invalid/synthetic.txt",
      "evidence_paths": [
        "linlocal/local-linux.invalid/synthetic.txt"
      ],
      "auth_context": {
        "account_label": "localadmin",
        "scope": "local",
        "scope_basis": "declared",
        "domain": null,
        "local_host": "local-linux.invalid",
        "auth_method": "password",
        "invocation": {
          "domain_arg": "",
          "local_auth_flag": true,
          "username_form": "bare",
          "credential_kind": "password",
          "auth_scope_declared": "local"
        }
      },
      "logical_id": "AR-L-f557fcabdd6bd1"
    },
    {
      "schema_version": "2",
      "finding_id": "FX2L-WINDOWS",
      "rule_id": "LAB-FX2L-WINDOWS",
      "host": "local-windows.invalid",
      "port": "0",
      "service": "winlocal",
      "severity": "high",
      "title": "Local Windows posture finding",
      "line": "synthetic lab observation",
      "evidence_path": "winlocal/local-windows.invalid/synthetic.txt",
      "evidence_paths": [
        "winlocal/local-windows.invalid/synthetic.txt"
      ],
      "auth_context": {
        "account_label": "localadmin",
        "scope": "local",
        "scope_basis": "declared",
        "domain": null,
        "local_host": "local-windows.invalid",
        "auth_method": "password",
        "invocation": {
          "domain_arg": "",
          "local_auth_flag": true,
          "username_form": "bare",
          "credential_kind": "password",
          "auth_scope_declared": "local"
        }
      },
      "logical_id": "AR-L-e33e6bfee0563f"
    }
  ]
}
